{
  "$schema": "http://json-schema.org/draft-07/schema#",
  "title": "RevokeAccess",
  "type": "object",
  "additionalProperties": false,
  "properties": {
    "messageId": {
      "$ref": "#/$defs/ID"
    },
    "type": {
      "type": "string",
      "const": "RevokeAccess"
    },
    "version": {
      "type": "string",
      "const": "1.0.0"
    },
    "occurredAt": {
      "$ref": "#/$defs/Timestamp"
    },
    "tenantId": {
      "$ref": "#/$defs/ID"
    },
    "regionId": {
      "$ref": "#/$defs/ID"
    },
    "clusterId": {
      "$ref": "#/$defs/ID"
    },
    "correlationId": {
      "$ref": "#/$defs/ID"
    },
    "data": {
      "$ref": "#/$defs/RevokeAccessData"
    },
    "idempotencyKey": {
      "$ref": "#/$defs/ID"
    }
  },
  "required": [
    "messageId",
    "type",
    "version",
    "occurredAt",
    "tenantId",
    "regionId",
    "clusterId",
    "correlationId",
    "data",
    "idempotencyKey"
  ],
  "$defs": {
    "Counter": {
      "type": "string",
      "pattern": "^(0|[1-9][0-9]{0,18})$",
      "description": "Nonnegative decimal counter, at most 19 digits. String on JSON to preserve precision in JavaScript; compare numerically."
    },
    "ID": {
      "type": "string",
      "pattern": "^[A-Za-z0-9][A-Za-z0-9_-]{0,127}$",
      "maxLength": 128
    },
    "RevokeAccessData": {
      "type": "object",
      "additionalProperties": false,
      "properties": {
        "userId": {
          "$ref": "#/$defs/ID"
        },
        "reason": {
          "type": "string",
          "minLength": 1,
          "maxLength": 256
        },
        "expectedRevision": {
          "$ref": "#/$defs/Counter"
        }
      },
      "required": [
        "userId",
        "reason",
        "expectedRevision"
      ]
    },
    "Timestamp": {
      "type": "string",
      "format": "date-time"
    }
  }
}
